recipe_id,ingredients
256171,unsalted butter brown sugar eggs vanilla extract matzo cake flour salt chocolate chips pecans
256172,butter dark brown sugar white sugar eggs vanilla extract flour baking soda salt baking powder dark chocolate chips
256173,butter onion tart apple chicken livers rinsed brandy heavy whipping cream lemon juice salt ground black pepper butter
256174,dried currants brandy based orange liqueur grand marnier butter onion garlic chicken livers heavy whipping cream dried thyme ground allspice salt ground black pepper
256175,white sugar flour eggs shortening crisco milk vanilla extract lemon extract baking powder
256176,english cucumber red bell peppers red onion stalks celery plum tomatoes garlic low sodium tomato juice white wine vinegar olive oil freshly ground black pepper sea salt dried basil dried parsley red pepper flakes optional
256177,cucumber roma tomatoes sweet onion vidalia red wine vinegar olive oil garlic leaves basil italian seasoning freshly ground black pepper salt optional
256178,cucumber green bell pepper spanish onion italian salad dressing wishbone basil tomatoes tomato juice
256179,carrots diagonally stalks celery diagonally cabbage onion snow peas olive oil sesame oil mushrooms garlic ginger root salt ground black pepper chicken broth udon noodles chestnuts yakisoba sauce soy sauce lemon sambal sauce balsamic vinegar white onions bean sprouts
256180,chicken stock linguine pasta serrano pepper napa cabbage shredded links kielbasa sausage onion cremini mushrooms salt ground white pepper cilantro
256181,tapioca flour raw unsalted almonds soy lecithin vanilla extract
256182,raw almonds dried dates vanilla extract salt
256183,butter green beans garlic powder optional salt almonds sweetened dried cranberries craisins orange juice ground white pepper
256184,green beans butter almonds garlic parsley salt ground black pepper red bell pepper mushrooms
256185,russet potatoes leek eggs flaxseed meal salt parmesan cheese
256186,cold unsalted butter smoked gouda cheese tiny cubes sharp cheddar cheese shredded sea salt freshly ground black pepper cayenne pepper flour
256187,sheets puff pastry dough egg apricot preserves your favorite flavor shredded gouda cheese rosemary leaves smithfield hometown original bacon flour dusting nonstick cooking spray
256188,smithfield thick bacon onion cherry preserves brown sugar red wine vinegar ground salt freshly ground black pepper thyme leaves
256189,thick baguette olive oil smithfield ham brie cheese fig jam
256190,your favorite bread butter coarse grained mustard smithfield ham white cheddar cheese berry cranberry sauce assorted salad greens
256191,yukon gold potatoes onion butter salt freshly ground black pepper eggs smithfield ham chives bread crumbs shredded parmesan cheese
256202,chicken breast cubed olive oil lemon salt pepper knorr rice sides herb butter heavy cream bag broccoli florets
256203,olive oil garlic green bell peppers ground italian sausage knorr rice sides chicken italian tomatoes parmesan cheese optional italian parsley garnish
256204,ortega salsa any ranch salad dressing green giant broccoli cheese veggie tots
256205,green giant mashed cauliflower any variety cayenne pepper sauce butter blue cheese green onion
256206,olive oil onion green giant riced cauliflower sweet potato red bell pepper garlic salt baby kale spinach optional sriracha hot chile sauce optional eggs fried poached
256207,vegetable oil garlic ginger green giant riced cauliflower medley soy sauce egg scrambled
256208,green giant riced cauliflower egg shredded mozzarella cheese parmesan cheese your favorite pizza toppings
256209,ground beef ortega salsa any green giant cauliflower veggie tots shredded mexican blend cheese shredded lettuce tomato
256210,green giant cheddar bacon mashed cauliflower flour egg green onions olive oil
256211,green giant garlic herb mashed cauliflower olive oil baby spinach shredded mozzarella cheese parmesan cheese
256212,green giant broccoli veggie tots chicken nuggets grape tomatoes sticks string cheese each bamboo skewers pasta sauce heated
256213,green giant garlic herb mashed cauliflower milk chicken vegetable broth parmesan cheese
256214,olive oil chicken breasts onion garlic green giant riced cauliflower any variety chicken broth parmesan cheese lemon juice oregano
256215,green giant broccoli veggie tots shredded cheddar cheese bacon green onions ranch salad dressing
256216,green giant cheddar bacon mashed cauliflower non fat greek yogurt sour cream green onions
256217,ground beef green giant mixed vegetables beef broth ketchup worcestershire sauce flour shredded cheddar cheese bacon green onions green giant original with olive oil sea salt mashed cauliflower
256218,olive oil onion mushrooms garlic dry white wine chicken broth green giant riced cauliflower medley asparagus parmesan cheese
256219,ground turkey chicken green giant riced cauliflower sweet potato onion garlic salt shredded mozzarella cheese tomato sauce parmesan cheese italian seasoning red green bell peppers
256220,green giant riced cauliflower sweet potato butter brown sugar ground cinnamon salt
256221,ground beef ortega taco seasoning mix tomato corn olives optional shredded mexican blend cheese green giant cauliflower veggie tots
256222,ground beef onion ketchup dill pickle dill pickle relish mustard shredded cheddar cheese tomato green giant broccoli cheese veggie tots
256223,butter onion salt flour garlic milk shredded cheddar cheese elbow macaroni green giant veggie tots any variety
256224,banana rolled oats dried cherries roasted unsalted pumpkin seeds ground cinnamon salt
256225,cooking spray sweet potato chunks eggs almond milk scoops vegan protein powder coconut oil baking soda
256226,gluten free baking mix cloud specialty bakery cornstarch white sugar baking soda baking powder almond milk silk eggs coconut oil vanilla extract lemon juice coconut oil no stick cooking spray
256227,almond milk spiced chai tea bags cans pumpkin puree white sugar ground flax seeds ground cinnamon vegetable oil salt deep dish pie
256228,ground flax seeds oat bran quick cooking oats brown rice raisins ground cinnamon soy milk
256229,elbow macaroni heavy whipping cream milk shredded gruyere cheese salt ground black pepper
256230,warm white sugar active dry yeast bread flour wheat flour coconut oil salt chia seeds wheat germ flax seeds millet hemp seeds salted roasted sunflower seeds oats
256231,peanut butter chocolate chips golden raisins raisins honey ground cinnamon ground nutmeg ground allspice hemp seeds chia seeds canola oil
256232,candy corn creamy peanut butter chocolate chips
256233,vanilla ice cream orange juice
256234,pint heavy whipping cream sweetened condensed milk
256235,cream cheese processed cheese velveeta olive oil yellow onion green bell pepper optional worcestershire sauce rib eye steak salt ground black pepper pasteurized process cheese spread cheez whiz
256236,honey lemon ginger root ground cinnamon boiling
256237,kabocha squash cubes carrots cubes red beet cubes olive oil yellow onion garlic leaves sage capers optional dried italian herbs himalayan salt if lemon leaves basil
256238,tapioca starch salt freshly ground black pepper garlic powder ground cayenne pepper ground paprika chicken breasts cubes coconut oil unsalted butter garlic freshly ginger coconut aminos raw honey sriracha sauce scallions sesame oil toothpicks
256239,vegetable oil onion jalapeno peppers cans beef pho broth ribeye steak rice noodles vermicelli burrito flour tortillas chili garlic sauce bean sprouts hoisin sauce thai basil cilantro lime
256240,rice vinegar sesame oil white sugar ginger lemongrass soy sauce cucumbers jalapeno pepper cilantro coarsely sprigs basil coarsely
256241,thompson seedless raisins olive oil onion garlic uncooked white rice salt boiling champagne dried apricots carrot butter sun dried tomatoes
256242,sweetened condensed milk coconut milk milk egg yolks cornstarch shredded coconut unsweetened cocoa powder whipping cream milk ladyfinger cookies shredded coconut bar dark chocolate
256243,flour almond flour white sugar butter egg yolks vanilla sugar
256244,potatoes carrots eggs onion salmon flaked mayonnaise
256245,beef short ribs olive oil yellow onion garlic smashed mushrooms tomatoes tomato paste salt pepper red wine low sodium beef stock sprigs rosemary parmesan cauliflower mash chicken broth cauliflower onion heavy cream butter salt pepper parmesan cheese
256246,strawberries yogurt cold almond milk dark sweet cherries ice cubes
256247,milk strawberries avocado
256248,butter egg brown sugar white sugar molasses vanilla extract wheat flour wheat germ ground ginger ground cinnamon baking soda salt icing confectioners sugar
256249,linguine pasta olive oil onion ground cumin cajun seasoning optional apple chicken sausage fresco pumpkin puree alfredo sauce milk parmesan cheese
256250,lemons limes stick unsalted butter adobo sauce from a of chipotles adobo sauce ancho chile powder oregano coarse sea salt turkey neck giblets low sodium turkey chicken broth flour
256251,butternut acorn kabocha squash raisins pecans roughly parsley sage zest of orange wide roughly silken tofu fine sea salt optional
256252,canola cooking spray non fat milk ground ginger eggs dry buttermilk pancake mix pecans precooked breakfast sausage patties links roughly granny smith apples maple syrup serving
256253,white wine vinegar sprigs rosemary garnish fine sea salt salmon fillets heavy cream ground cinnamon ground nutmeg ground
256254,onion garlic carrot celery stalk baby spinach egg ground turkey chicken quinoa then cooled low sodium soy sauce ground black pepper ketchup barbecue sauce
256256,bittersweet chocolate chips sweetened condensed milk vanilla extract white sugar milk butter heavy whipping cream butterscotch chips marshmallow cream flaky sea salt maldon
256257,grits yellow onion olive oil gallon regular grits uncooked unsalted butter shredded white cheddar cheese salt freshly black pepper shrimp olive oil yellow onion red bell pepper green bell pepper andouille sausage links uncooked shrimp count if hunt s tomatoes undrained sriracha hot sauce salt freshly black pepper
256258,butter yellow onion garlic ginger pouch hunt s recipe ready tomato paste hot madras curry powder ground cumin ground coriander paprika hunt s tomatoes chicken broth salt heavy whipping cream yogurt shredded turkey cilantro p f chang s steamed white rice
256259,olive oil onion red bell pepper poblano peppers cans hunt s tomatoes undrained cans garbanzo beans rinsed dry brown lentils sorted rinsed vegetable stock chili powder ground cumin dried oregano sweet potatoes salt freshly black pepper dinner rolls centers out shredded colby jack cheese avocado green onions cilantro leaves optional
256260,olive oil red onion carrots parsnips garlic ras el hanout seasoning garbanzo beans rinsed hunt s tomatoes undrained chicken broth dried apricots prunes raisins shredded turkey cilantro greek yogurt hot couscous optional
256261,white sugar lemon juice whiskey tullamore dew ice cubes optional
256262,simple syrup whiskey lemon juice ice cubes maraschino cherry optional
256263,dipping sauce egg yolk chili garlic sauce rice vinegar sea salt dashes ground black pepper olive oil tempura batter ice flour egg yolk olive oil rock shrimp
256264,oil ice cold tempura batter mix bananas confectioners sugar
256265,ice cubes flour arrowroot powder ice vegetable oil cauliflower broccoli red bell pepper baby carrots
256266,banana
256267,cooking spray potatoes butter onion flour dijon mustard salt ground black pepper milk shredded cheddar cheese ham
256268,white vinegar potatoes very olive oil ham condensed cream of mushroom soup campbell s onion milk capers salt cayenne pepper chili powder shredded sharp cheddar cheese pepper jack cheese shredded mozzarella cheese parsley flakes
256269,cooking spray confectioners sugar lukewarm unflavored gelatin unflavored gelatin white sugar corn syrup salt vanilla extract confectioners sugar
256270,miniature marshmallows corn syrup coffee extract chocolate chips confectioners sugar
256271,cold chicken broth uncooked rice rinsed cold very ginger root optional preserved thousand year eggs cod fillet rice wine sesame oil soy sauce ground white pepper salt green onion optional
256272,kernel corn chicken broth jasmine rice chicken breast cubed salt ground white pepper sesame oil
256273,japanese sushi rice chicken broth turkey carcass salt ground black pepper
256274,low fat greek yogurt raw honey matcha tea powder full leaf tea company vanilla extract unsweetened coconut milk chia seeds mango chunks
256275,piece ginger root milk white sugar
256276,broccoli heavy whipping cream eggs egg yolk freshly ground black pepper salt unsalted butter shallots vegetable broth
256277,zucchini cubes olive oil italian bread crumbs parmesan cheese garlic salt ground black pepper
256278,oil onion canadian bacon white cabbage beer
256279,butter green cabbage shredded ground black pepper
256280,olive oil red potatoes thick parsley garlic split chicken breasts with skin salt ground black pepper red onion wedges balsamic vinegar
256281,raw peanuts peanut oil white sugar salt
256282,roasted unsalted peanuts honey
256283,sauce apple cider vinegar maple syrup cold quick mixing flour wondra brown sugar pork chops center pork chops salt ground black pepper olive oil butter brown sugar
256284,butter white sugar raspberries dark red kidney beans almond meal eggs unsalted butter raspberry extract almond extract white sugar baking powder salt
256285,cooking spray yellow cake mix duncan hines eggs vegetable oil almond extract berry cranberry sauce vanilla frosting
256286,olive oil cubed beef stew onion yellow potatoes carrots rib celery garlic flour butter bay leaf salt ground black pepper low sodium beef stock milk sprig rosemary peas puff pastry
256288,yellow corn maple syrup eggs milk salt if using fine salt cayenne pepper flour baking powder heavy cream butter
256294,red yellow bell peppers yellow banana pepper poblano pepper jalapeno pepper onion garlic olive oil chicken broth cilantro leaves garnish dried mexican oregano ground cumin white sugar ground black pepper cans hunt s fire roasted tomatoes undrained salt garnish cotija cheese cilantro leaves lime wedges
256295,vegetable oil flour paprika salt pepper cumin dried mexican oregano garlic powder beef chuck roast cubed garlic cans hunt s tomatoes beef broth bay leaves red pepper flakes red potatoes carrots corn onion cabbage coarsely
256296,beef skirt steak carne asada seasoning steak fries hunt s tomatoes onions cilantro red pepper flakes eggs shredded mexican cheese blend guacamole
256297,uncooked chorizo sausage onion cilantro leaves hunt s tomatoes olive oil mexican squash spiralized garlic red pepper flakes
256298,olive oil chicken breasts adobo seasoning smoked paprika ground black pepper chili powder onion uncooked long grain white rice hunt s tomatoes kernel corn garlic low sodium chicken broth avocado tomato pepper jack cheese cilantro leaves garnish optional snipped chives optional
256299,vegetable oil onion garlic roasted red bell peppers hunt s tomato paste chili powder ground ancho chile powder ground cumin spanish paprika cans hunt s tomatoes undrained salt pepper eggs
256300,pork tenderloin cans hunt s tomatoes undrained onion garlic dried oregano brown sugar ground ancho chile powder
256301,beef skirt steak carne asada seasoning garlic powder vegetable oil sweet onion red bell pepper jalapeno pepper hunt s tomatoes potatoes salt pepper butter eggs whisked shredded mexican cheese blend flour tortillas
256302,dried rice noodles soy sauce rice wine brown sugar ginger cornstarch vegetable oil red pepper flakes garlic shrimp bok choy hunt s tomatoes green onions
256303,active dry yeast warm degrees f hunt s tomatoes shredded swiss cheese cumin prosciutto rosemary freshly ground black pepper salt nutmeg eggs unbleached flour unsalted butter olive oil
256304,elbow macaroni butter milk flour shredded colby monterey jack cheese hunt s tomatoes cans salsa verde ground black pepper
256305,chorizo sausage chicken breast cauliflower rice onion yellow orange bell pepper salt ground black pepper garlic hunt s tomatoes bay leaves thyme leaves saffron threads dried basil tomato paste cubes chicken bouillon peas tilapia fillets
256306,uncooked chorizo sausage onion vegetable oil hash brown potatoes seasoning salt hunt s tomatoes coarsely cilantro avocado cubed
256307,olive oil onion poblano peppers garlic chorizo sausage chicken stock broth cans hunt s no salt added petite tomatoes mexican corn salsa verde ground cumin ground chipotle chile pepper cod fillets other firm white fish like halibut chunks raw shrimp green onions cilantro lime wedges
256308,turkey chorizo ground turkey salt garlic powder chili powder smoked paprika sweet paprika ground cumin ground coriander dried mexican oregano dried chipotle chili pepper cinnamon ground cider vinegar spaghetti squash spaghetti squash olive oil white onion garlic chili powder salt ground cumin black beans rinsed fire roasted corn canned green chilies hunt s fire roasted tomatoes undrained shredded queso chihuahua mexican blend cheese cilantro
256309,olive oil onion ground cumin chili powder salt chipotle peppers adobo sauce adobo sauce from chipotle peppers hunt s fire roasted tomatoes with garlic chicken broth heavy cream
256310,meatballs ground pork fish sauce garlic ginger root lemon grass puree cilantro peanut oil sauce peanut oil onion hunt s tomatoes red curry paste canned coconut milk salt cilantro optional
256311,tube chorizo cacique hunt s tomatoes pizza dough shredded monterey jack cheese cotija cheese cilantro
256312,black beans rinsed corn green chilies hunt s tomatoes green onions shrimp cilantro cumin garlic powder lime olive oil hot sauce salt pepper optional
256313,whipped cream honey graham crackers banana
256314,ice confectioners sugar vanilla extract
256315,unsalted butter white sugar cultured sour cream eggs egg yolks flour baking powder ground cinnamon lemon zest blanched almonds white sugar
256316,slivered almonds chia seeds greek yogurt blueberries milk
256317,cooking spray chocolate cake mix duncan hines eggs vegetable oil evaporated milk white sugar marshmallows bag shredded coconut evaporated milk butter white sugar chocolate chips almonds
256318,milk eggs bars white chocolate heavy whipping cream almond extract
256319,cooking spray white sugar butter coconut milk eggs flour almond flour baking powder ground cinnamon coconut raisins
256320,apple cider golden raisins apple cider vinegar jasmine rice white sugar brown sugar ground cinnamon olive oil granny smith apple sweet onion stalk celery ground white pepper salt ground cinnamon blanched slivered almonds
256321,almonds chunks dark chocolate chips cacao
256322,uncooked shrimp salt cayenne pepper olive oil red onion garlic freshly gingerroot lime mushrooms hunt s tomatoes chicken broth red pepper flakes coconut milk fish sauce leaves thai basil curry powder cilantro optional lime optional
256323,firm tofu tamari limes sesame seeds sriracha sauce beet juice sesame oil ginger dulse powder sheet nori seaweed cucumber green onions avocado oil wonton wrappers triangles
256324,wild rice brown rice cherries brown sugar almonds celery orange juice red wine vinegar orange zest
256325,brussels sprouts maple syrup olive oil dijon mustard apple cider vinegar sweetened dried cranberries cinnamon roasted almonds
256326,olive oil onion spicy andouille sausage salt low sodium chicken broth swanson natural goodness split peas picked over bay leaves zucchini salt ground black pepper
256327,corn kernels butter salt ground black pepper mayonnaise thick italian bread honey ham honey turkey lacy swiss cheese amish swiss cheese american cheese shredded cheddar cheese roma tomato sweet onion green onion
256328,pork ribs salt ground black pepper hoisin sauce white sugar soy sauce white wine tomato paste garlic asian chili garlic sauce chinese five spice powder cooking spray
256329,cooking spray devil s food cake mix butter egg sweetened condensed milk peanut butter chocolate chips peanut butter reese s
256330,cooking spray cinnamon swirl cake mix with cinnamon flavoring dried dates walnuts optional egg white substitute olive oil
256331,flour brown sugar baking powder ground cinnamon salt
256337,yellow cake mix with pudding butter shredded coconut eggs maraschino cherries optional
256341,pint wide mouth canning with lids rings shortening raisins hot white sugar shortening eggs flour ground cinnamon baking soda salt baking powder shredded zucchini walnuts optional vanilla extract
256342,red velvet cake mix butter eggs egg yolks cream cheese sour cream white sugar vanilla extract
256343,vegetable oil flour onion celery green onion parsley garlic chicken broth salt ground red chile pepper shrimp hot rice sprigs parsley optional
256344,canola oil flour onion green bell pepper stalks celery andouille sausage cajun seasoning garlic freshly ground black pepper low sodium chicken stock shrimp
256345,grapeseed oil carrots leeks shiitake mushrooms onion chicken thighs salt ground black pepper chicken broth miso paste garlic soy sauce piece ginger root sriracha sauce napa cabbage torn baby bok choy
256346,crust graham crackers butter salt filling cream cheese neufchatel cheese white sugar eggs vanilla extract heavy whipping cream semisweet chocolate chips flour glaze sweet cherries apricot jam white sugar cornstarch
256347,dry pinto beans rinsed onion salsa optional roughly cilantro jalapeno pepper garlic tomato bouillon vegetable bouillon chili powder ground paprika ground cumin ground black pepper
256348,flounder fillets salt ground black pepper lemon juice butter onion
256349,vegetable oil mackerel fillets salt ground black pepper butter lemon juice ground paprika
256350,flour oat bran baking powder baking soda salt brown sugar butter egg vanilla extract mashed bananas almond milk cranberries coarsely walnuts
256351,flour baking powder ground cinnamon baking soda ground nutmeg salt white sugar butter eggs mashed bananas dried cranberries walnuts streusel nut topping brown sugar flour butter cubes walnuts
256352,pineapple juice orange juice cranberry juice liter bottles lemon lime soda up pint raspberry sherbet
256353,orange sherbet orange drink sunnyd cans bottles lemon lime soda up orange soda
256354,vegetable oil chicken wings costco defrosted vegetable oil hot sauce frank s redhot optional barbeque sauce
256355,chicken wings barbeque sauce kraft original maple syrup mrs butterworth s
256356,ground beef sea salt coarsely ground black pepper garlic powder dried rosemary mustard ground paprika dill weed white onion egg worcestershire sauce unsalted saltine crackers
256357,sriracha sauce huy fong foods apple cider vinegar maple syrup ghost pepper hot sauce
256358,lime juice dark rum olive oil soy sauce garlic ground cinnamon ground ginger hot sauce
256359,soy sauce honey garlic ground cinnamon hot pepper sauce tabasco ground paprika ground ginger yogurt
256360,olive oil assorted wild mushrooms yellow onion portobello mushrooms thyme rosemary sea salt dry white wine gluten free chicken broth heavy whipping cream parsley gluten free flour sea salt ground white pepper
256361,vegetable broth butter carrot matchstick white onion matchstick leek matchstick stalks celery matchstick garlic yellow squash matchstick zucchini matchstick shiitake mushrooms chanterelle mushrooms oyster mushroom caps coarsely white button mushrooms portobello mushroom flour heavy whipping cream cayenne pepper salt ground black pepper chives
256362,devil s food cake mix duncan hines eggs vegetable oil cans chocolate frosting whipped cream topping strawberries
256363,cooking spray strawberry cake mix betty crocker white chocolate chips sour cream vegetable oil eggs warm cheesecake pudding mix jell o
256364,dried black eyed peas shredded cabbage olive oil green onions lemon parsley salt ground black pepper
256365,shredded white red cabbage avocado red bell pepper hemp seeds lemon juice cilantro red onion fine sea salt
256366,green cabbage mangoes carrot stalk celery the diagonal green onions smooth unsalted peanut butter lime juice low sodium soy sauce cilantro garlic ground ginger unsalted dry roasted peanuts
256367,cooking spray vegetable oil ranch dressing buffalo wing sauce frank s redhot garlic powder onion powder salt idaho potatoes cubes chicken breasts cubes bacon shredded colby jack cheese green onions
256368,chicken tenders cream cheese ranch dressing buffalo wing sauce shredded colby jack cheese rice shredded sharp cheddar cheese corn chips tostitos
256369,butter brown sugar white sugar eggs vanilla extract flour baking soda salt pistachios white chocolate chips
256370,shortening butter white sugar brown sugar egg vanilla extract almond extract flour baking soda salt pistachios coconut flakes
256371,cooking spray yellow cake mix eggs vegetable oil sweetened shredded coconut cream of coconut white rum pineapple chilled whipped topping
256372,cake bananas mashed eggs vegetable oil banana liqueur rum yellow cake mix instant vanilla pudding mix glaze white sugar butter banana liqueur rum
256373,cooking spray sweet potatoes white sugar milk eggs butter cubed vanilla extract streusel topping pecans sweetened flaked coconut brown sugar flour butter
256374,cooking spray pam strawberries white sugar blueberries red cooking wine lemon juice lasagna noodles confectioners sugar
256375,chia seeds proof vodka tito s
256376,bacon baby potatoes vegetable oil salt ground black pepper butter mascarpone cheese green onions shredded cheddar cheese shrimp creole seasoning
256377,peach basil syrup unpeeled peaches coarsely white sugar sprigs basil tied together with string cocktail ice cubes bourbon dashes aromatic bitters prohibition aromatic bitters lime sparkling la croix peach leaf basil
