recipe_id,ingredients
256804,kernel corn shredded sharp cheddar cheese green chiles undrained sour cream mayonnaise feta cheese mccormick white chicken chili seasoning mix cilantro
256805,ground beef onion kitchen basics unsalted beef stock mccormick sloppy joes seasoning mix cider vinegar worcestershire sauce shredded cheddar jack cheese whipped cream cheese
256806,ketchup molasses mccormick slow cookers sweet smoky pulled chicken seasoning mix chicken thighs whipped cream cheese shredded cheddar cheese red onion
256807,sour cream mayonnaise lemon juice mccormick spinach dip seasoning mix shredded maine lobster green onions
256808,italian bread milk mccormick pork gravy mix shredded swiss cheese dill pickles coarsely mayonnaise yellow mustard cubed ham deli roast pork
256809,milk mccormick original country gravy mix ground breakfast sausage mixed vegetables shredded cheddar cheese
256810,ground bison onion mccormick hot chili seasoning mix fire roasted tomatoes processed cheese food velveeta cubes sour cream jalapeno peppers
256811,eggs white sugar olive oil orange zest chinese five spice powder flour baking powder salt
256813,octopus tentacles separated raw shrimp red onion salt bay leaves freshly ground black pepper roma tomatoes sriracha sauce
256814,dark roast ground coffee folgers milk white sugar ice
256815,milk white vinegar flour white sugar ground flax seeds unsweetened cocoa powder baking soda baking powder salt cold brewed coffee eggs vegetable oil
256816,coarsely ground coffee beans white sugar ice cubes
256817,raw shrimp albacore tuna lemon juice lime juice mango pale ale going the sun ipa tomato yellow onion jalapeno pepper mango hot sauce sriracha sauce bacon napa cabbage leaves separated radicchio leaves separated
256818,ipa beer green onions garlic red pepper flakes bay leaf raw shrimp salt ground black pepper parsley
256819,mushrooms sprigs thyme serrano pepper brine white wine salt white sugar garlic black peppercorns coriander seeds lemon zest
256820,chicken broth cans black beans cans tomatoes with green chile peppers pale ale corn red enchilada sauce frontera onion taco seasoning jalapeno pepper chicken breasts cilantro
256821,canola oil onions garlic beef broth chicken broth pale ale ground black pepper bay leaves french bread shredded mozzarella cheese parmesan cheese
256822,pears white sugar honey vanilla bean split cinnamon stick pods cardamom conference pears pastry flour confectioners sugar salt cold unsalted butter cold unsalted butter egg yolk frangipane white sugar unsalted butter ground blanched almonds egg egg white flour cornstarch almond extract vanilla extract
256823,cans peaches heavy syrup well butter brown sugar cinnamon nutmeg sticks butter white sugar eggs almond extract flour baking powder salt milk
256824,egg yolks white sugar salt vanilla extract heavy cream white sugar culinary torch
256825,mixed berries white sugar orange zest orange juice cornstarch
256826,flour brown sugar baking powder baking soda salt chunky peanut butter sour cream reduced fat butter boiling semisweet chocolate chips white sugar unsweetened cocoa powder milk warmed vanilla extract
256827,cake white sugar refined coconut oil stick unsalted butter eggs flour baking powder salt full fat coconut milk frosting cream cheese stick unsalted butter confectioners sugar salt vanilla extract sweetened coconut flakes
256828,dried chile de arbol peppers stemmed coriander seeds cumin seeds yellow black mustard seeds black peppercorns ground turmeric
256829,coriander seeds cumin seeds black peppercorns cardamom seeds from green white cardamom pods bay leaves dried chile de arbol peppers stemmed cinnamon stick broken smaller
256830,milk yogurt freshly cumin seeds salt cayenne pepper red green grapes mint cilantro
256831,butter flax seed meal ground cinnamon milk white sugar brown sugar vanilla extract egg yolks brown sugar maple syrup thick bacon maple syrup sea salt
256832,olive oil desired white onion sofrito garlic ground cumin bay laurel leaf salt ground black pepper chicken stock green plantains
256833,oil plantains each eggs separated white sugar white sugar vanilla extract flour baking powder salt queso fresco
256834,chicken broth quinoa sweet potato red onion olive oil salt freshly ground black pepper garlic ginger root chicken breast lime juice smooth peanut butter soy sauce honey sesame oil baby spinach avocado cilantro sesame seeds
256856,bread flour eggs eggs separated white sugar warm dry yeast orange zested lime zested salt butter butter topping white sugar butter flour candied citrus peels
256857,stock gallon tomato sauce yellow onion chicken bouillon knorr garlic dried oregano meatballs ground beef eggs tomato sauce uncooked white rice cilantro seasoned salt season dried oregano leaves onion powder garlic powder ground black pepper ground cumin baby potatoes carrots diagonally stalks celery diagonally zucchini thickly shredded green cabbage lemon wedges optional avocados optional cilantro optional
256858,chicken broth tomato salt ground black pepper ground chuck hot pepper garlic ground cumin pepper jack cheese cubed hard boiled eggs chunks optional potatoes cubed onion uncooked white rice cilantro
256859,meatballs ground beef tomatillos husked eggs uncooked white rice garlic ground cumin salt soup tomatoes white onions tomatillos husked cans chipotle peppers adobo sauce garlic vegetable oil chicken broth salt ground black pepper carrots stalks celery cilantro ground cumin lemons wedges corn tortillas
256860,quinoa steel oats almond meal flaxseed meal ground cinnamon
256861,quinoa rinsed dried apricots slivered almonds flax seeds ground cinnamon ground nutmeg
256862,coconut oil coconut milk quinoa salt coconut oil optional honey eggs shredded unsweetened coconut optional vanilla extract almonds dates chia seeds walnuts ground flax seeds carrot roughly apple roughly
256863,honey sriracha sauce sriracha chile paste onion jalapeno pepper soy sauce dried cilantro lime juice skin salmon fillets olive oil
256864,chicken legs skin olive oil ground thyme garlic powder ground paprika salt ground black pepper raw honey butter sriracha sauce soy sauce
256865,canola oil garlic ketchup honey soy sauce
256866,chicken broth brown sugar honey soy sauce garlic ginger root cornstarch
256867,honey soy sauce cornstarch garlic olive oil chicken breasts warm rice soft flour tortillas carrot matchsticks
256868,filling cream cheese granulated sugar eggs vanilla lemon juice batter duncan hines red velvet cake mix vegetable oil eggs optional garnish powdered sugar
256869,duncan hines golden yellow cake mix quick cooking oats salt milk eggs butter margarine
256870,salmon fillets salt ground black pepper olive oil honey brown sugar sriracha sauce optional soy sauce garlic
256871,chicken drumsticks peaches undrained hoisin sauce barbeque sauce piece ginger garlic
256872,cooking spray chicken drumsticks cajun seasoning poultry seasoning garlic powder salt ground black pepper flour barbeque sauce
256873,olive oil hot italian sausage italian sausage sweet onions garlic dried oregano red pepper flakes tomato paste beef broth tomatoes with basil tomatoes with basil sweet wine optional sprigs basil salt ground black pepper ricotta cheese shredded mozzarella cheese parmesan cheese farfalle bow tie pasta
256874,ground beef garlic powder onion powder cans beef stock tomatoes italian seasoning fusilli pasta parmesan cheese
256875,italian turkey sausage casings onions mushrooms garlic chicken broth tomato sauce italian seasoned tomatoes uncooked mafalda pasta spinach shredded mozzarella cheese parmesan cheese basil
256876,peppercorns beef tenderloin steaks salt butter vegetable oil brandy heavy whipping cream brandy
256877,black peppercorns thick tenderloin steaks butter shallot cognac red wine beef broth heavy whipping cream
256878,belgioioso unwrap roll mozzarella sheet spring green lettuce tomato bacon
256879,belgioioso mozzarella ciliegine cheese olive oil dried basil dried oregano red pepper flakes salt pepper pickled sweet cherry peppers peppadew peppers
256880,olive oil red onion zucchini eggs salt ground black pepper belgioioso mozzarella pearls cheese oil sun dried tomatoes basil
256881,rustic italian bread belgioioso mozzarella cheese roasted tomatoes roasted zucchini roasted asparagus roasted mushrooms basil leaves prosciutto
256882,cream cheese dill pickles sweet onion pickle juice dried dill weed salt freshly ground black pepper
256883,fat free cream cheese dill pickle juice dill pickles onion salt
256884,red lentils fine bulgur wheat olive oil spring onions tomato paste parsley lemon red pepper flakes ground cumin salt
256885,olive oil onion garlic red bell pepper carrot cubes mushrooms red wine tomatoes vegetable broth green lentils ground paprika dried basil dried oregano mixed dried herbs ground nutmeg
256886,egg egg yolk coconut milk white sugar vanilla extract freshly nutmeg thick very stale french bread crosswise butter coconut flakes
256887,unsalted butter onion garlic vegetable broth broccoli heavy whipping cream salt freshly ground black pepper freshly nutmeg ground cayenne pepper country white bread crosswise shredded sharp cheddar cheese
256888,pate spice ground ground nutmeg ground ginger cayenne pepper pate pork shoulder cubes duck leg fatty bacon chicken livers roughly yellow onion shallot italian parsley cognac salt garlic freshly ground black pepper pink curing salt instacure optional heavy whipping cream dry bread crumbs eggs dried cherries optional pistachios optional bacon
256889,beef skirt steak across the grain salt freshly ground black pepper cornstarch vegetable oil sauce oyster sauce dry sherry soy sauce ketchup chicken broth cornstarch final assembly broccoli florets vegetable oil vegetable oil garlic cayenne pepper
256890,spice rub fennel seeds garlic sage leaves freshly ground black pepper rosemary salt red pepper flakes lemon zested olive oil pork tenderloin bacon
256891,mayonnaise tarragon sriracha sauce ground paprika lemon juice ground cayenne pepper salt lobster tails split
256892,processed cheese food velveeta cubed tomatoes green chiles ro tel no boil lasagna noodles canned chili shredded cheddar cheese
256893,mango cubes fat free milk apple juice banana classic french vanilla flavor carnation breakfast essentials start
256894,classic french vanilla flavor ready drink carnation breakfast essentials complete nutritional drink banana instant coffee crystals ice cubes
256895,strawberry kiwi juice strawberry sensation flavor carnation breakfast essentials complete nutritional drink berries strawberries raspberries blueberries ice cubes
256896,quick cooking oats milk rich milk chocolate flavor carnation breakfast essentials start complete nutritional drink ice cubes
256897,chocolate soy milk rich milk chocolate flavor carnation breakfast essentials start complete nutritional drink banana ice cubes
256898,coffee cooled vanilla dreyer s edy s slow churned ice cream rich milk chocolate flavor carnation breakfast essentials start complete nutritional drink
256899,fat free milk pineapple chunks ice cubes classic french vanilla flavor carnation breakfast essentials start complete nutritional drink banana pineapple juice
256900,peach vanilla fat free yogurt fat free milk unsweetened strawberries classic french vanilla flavor carnation breakfast essentials start complete nutritional drink
256901,orange juice peaches banana fat free yogurt classic french vanilla flavor carnation breakfast essentials start complete nutritional drink
256902,rich milk chocolate flavor carnation breakfast essentials start complete nutritional drink peanut butter soy milk
256904,ball park original hamburger buns burgers ground beef eggs worcestershire sauce bacon green onions garlic danish blue cheese blackening spice dried oregano red pepper flakes freshly ground black pepper sea salt onion powder brown sugar
256905,ball park original hot dog buns garlic powder mayonnaise olive oil sweet onion jerk cajun seasoning hot dogs monterey jack cheese shredded pineapple optional
256906,ball park hamburger buns olive oil burgers ground turkey breast patties garlic granules salt ground black pepper ground cumin sweet paprika olive oil guacamole avocados green onion lemon lime chili powder favorite mexican salsa salt trimmings desired mayo lettuce tomato onion pickles
256907,ball park tailgaters brat buns brats bratwurst beer cabbage olive oil red onion red cabbage green cabbage apple cider vinegar brown sugar paprika sea salt ground black pepper ground allspice german deli mustard
256908,ball park hamburger buns butter remoulade sauce mayonnaise green onion grainy mustard flat leaf parsley ketchup white wine vinegar horseradish garlic granules dashes hot pepper sauce tabasco salt pepper crab cakes mayonnaise egg red onion italian parsley cans crabmeat picked clean fine bread cracker crumbs seafood seasoning bay sea salt ground black pepper cayenne pepper vegetable oil trimmings include lettuce tomato onion desired lemon wedges
256909,bread pudding day ball park hamburger buns dried sour cherries other dried fruit cherry apple juice sugar white chocolate chips milk sugar cinnamon ground nutmeg eggs topping creme fraiche confectioners sugar vanilla extract
256910,herbed mayonnaise mayonnaise herbes de provence worcestershire sauce lemon juice ball park hamburger buns thick smoked bacon button mushrooms soy sauce ground beef garlic granules salt pepper swiss cheese burger trimmings desired including lettuce tomato onion pickles
256911,ball park brand franks ball park hot dog buns yellow mustard yellow onion cheddar cheese jalapeno pepper chili ground beef vegetable oil sweet yellow onion red bell pepper tomato sauce chili powder garlic granules paprika salt pepper
256912,ball park hamburger buns olive oil burgers ground bison salt sweet paprika garlic granules onion powder ground black pepper olive oil smoky bbq sauce ketchup molasses apple cider vinegar worcestershire sauce ground chipotle pepper garlic granules onion powder salt ground cumin dry mustard thick dill pickle hamburger trimmings lettuce tomato onion mustard if desired
256913,ball park hamburger buns butter if yellow onion mushrooms dried italian herbs garlic granules sweet paprika salt pepper coarsely spinach bacon shredded cheddar monterey jack cheese blend eggs milk
256914,ball park hamburger buns pork butt roast pork rub brown sugar sweet paprika garlic granules ground cumin ground cayenne ground ginger salt ground black pepper bbq sauce ketchup brown sugar apple cider vinegar mustard honey worcestershire sauce liquid smoke flavoring pork rub sweet sour slaw white balsamic vinegar olive oil brown sugar garlic granules salt ground black pepper shredded red cabbage shredded carrots cucumber italian parsley
256915,ball park hot dog buns tomato sauce garlic granules dried italian herb blend sweet paprika salt ground black pepper bulk italian sausage olive oil garlic granules dried italian herb blend pepperoni mozzarella cheese parmesan cheese oregano sprigs optional red pepper optional
256916,grain sorghum brussels sprouts cubed butternut squash jalapeno sesame seeds olive oil radicchio eighths leek miso dressing sesame oil brown miso white rice vinegar sesame oil ginger black beans
256917,bone chicken drumsticks paprika olive oil garlic salt ground black pepper red potatoes lemons
256918,white american cheese land o lakes ground cumin ground black pepper salt red pepper flakes jalapeno pepper chili powder
256919,bananas milk heavy whipping cream
256920,rolled oats coconut milk beverage silk banana powdered peanut butter pb agave nectar
256921,cooking spray mexican cajeta caramel cake devil s food cake mix eggs vegetable oil flan sweetened condensed milk evaporated milk eggs cream cheese milk mexican vanilla extract
256922,barley cucumbers tomatoes onion parsley stemmed olive oil lemons paprika pink salt garlic ground black pepper
256923,lukewarm white sugar active dry yeast soy milk soy butter avocado oil dry egg replacer ener g salt bread flour cooking spray honey
256924,mangos chunks pineapple chunks cider vinegar white sugar pouch liquid pectin habanero chiles stemmed
256925,flour sifted baking powder salt greek yogurt coconut oil oat milk vanilla extract honey egg strawberries frosting shredded coconut cream cheese honey vanilla extract
256926,roasted cashew flour coarsely raw cashews honey coarse salt cake oat milk coconut oil eggs brown rice flour arrowroot powder baking powder guar gum ground cinnamon ground nutmeg ground ginger ground chili powder salt
256927,dried red dates rinsed goji berries rinsed vegetable oil carrots ginger salt vegetable stock powder sesame oil ground black pepper watercress
256928,watercress stemmed dijon mustard white wine vinegar salt olive oil shallots parsley thyme tomato chives avocado cucumber rinsed hearts of palm artichoke hearts lump crabmeat
256929,canola oil leeks thick sweet onion shallots garlic carrots stalks celery beet salt ground black pepper beef broth white wine sweet soy sauce umeboshi paste tamarind paste
256930,yogurt sour cream dried dill dried mint raisins cucumber walnuts
256931,unseasoned green olives coarsely olive oil ground walnuts ground almonds pomegranate molasses mint tarragon lemon juice garlic balsamic vinegar ground thyme salt ground black pepper
256932,japanese cucumber salad japanese cucumbers very salt rice vinegar soy sauce white sugar sesame oil sesame seeds teriyaki sauce soy sauce mirin sake white sugar chicken vegetable oil bone skin chicken thighs toppings corn tortillas sour cream sriracha sauce scallions black sesame seeds optional
256933,cashew cheese unsalted raw cashews red wine vinegar white miso raw sugar salt pesto roughly basil leaves roughly raw walnuts olive oil nutritional yeast lemon garlic eggplant purple eggplant olive oil salt ground black pepper marinara sauce
256934,raw cashews red bell pepper roughly roughly onion lemon jalapeno pepper optional garlic nutritional yeast paprika ground turmeric optional dried mustard optional sea salt freshly black pepper bunches curly kale stemmed
256935,oil deep chicken wings soy sauce aloha shoyu sesame oil pink hawaiian salt ground macadamia nuts red pepper flakes
256936,ahi steaks cubes soy sauce maui onion green onion chile pepper optional sesame oil sesame seeds optional macadamia nuts optional ginger sea salt
256937,ahi tuna cubes green onion ground roasted macadamia nuts cilantro lime juice sesame oil ginger red pepper flakes sriracha sauce
256938,green onion shallot soy sauce lime sheets seaweed nori sesame seeds sesame oil smooth peanut butter chile paste sashimi grade ahi tuna steaks cubes
256939,marinade reduced sodium soy sauce barbeque sauce olive oil maple syrup liquid smoke paprika chili powder optional cayenne pepper optional chinese eggplant very olive oil brown sugar
256940,olive oil eggplant cubes olive oil salt ground black pepper onions garlic paprika coarse salt ground coriander ground fennel seeds ground black pepper ground cumin ground ginger ground turmeric cans stewed tomatoes hand juice reserved red bell peppers white wine lemon juice chicken separated breasts split skinned marjoram
256941,cans tomatoes eggplant rounds yellow squash zucchini rounds onion mushrooms with juice olive oil garlic dried oregano salt
256942,salt japanese eggplants left intact vegetable oil vegetable oil white onion garlic cubed stew cube beef bouillon ground cumin saffron tomato paste tomato sauce
256943,orange juice ground cinnamon rapid rise yeast white sugar unsalted margarine fleischmann s eggs orange zested bread flour salt baking powder coins wrapped aluminum foil egg white vanilla extract
256944,white rice yellow lentils moong dal ghee clarified butter salt desired coarsely ground black pepper cumin seeds curry leaves piece ginger root optional cashews optional
256945,cooking spray beef sandwich steaks onion worcestershire sauce garlic salt ground black pepper pizza dough pillsbury american cheese
256946,cooking spray shredded chicken blue cheese cream cheese hot sauce crust pizza dough pillsbury
256947,vegetable oil yellow onions matchstick garlic butter warm olive oil bread flour white sugar active dry yeast coarse salt parsley rosemary dried marjoram flour optional blue cheese vegetable oil
256948,flour bread dough peanut butter grape jelly egg white sugar
256949,cooking spray pizza dough smoked ham genoa salami pepperoni shredded mozzarella cheese white cheddar cheese bell pepper rings egg yolks
256950,cooking spray bratwurst links casings italian seasoning ground black pepper eggs milk garlic powder seasoned salt garlic salt shredded mexican cheese blend
256951,sausages eggs sea salt freshly ground black pepper shredded fontina cheese optional scallions dried parsley dried basil dried oregano garlic powder red pepper flakes optional
256952,cooking spray olive oil spinach egg whites egg yolks parmesan cheese shredded mexican cheese blend garlic powder sea salt
256953,cooking spray eggs spinach red bell pepper fully ham egg whites feta cheese salt ground black pepper
256954,cooking spray center bacon butter onion garlic eggs garlic powder salt ground black pepper shredded cheddar cheese
256955,hungry jack buttermilk pancake waffle mix milk eggs vegetable oil hungry jack original syrup serving if desired fully sausage links
256956,hungry jack complete buttermilk pancake waffle mix white chocolate chips blueberries raspberries strawberries granulated sugar hungry jack original syrup
256957,thick bacon maple syrup serving brown sugar pumpkin pie spice hungry jack pancake waffle mix milk canned pumpkin pumpkin pie mix canola oil pumpkin pie spice serving whipped cream
256958,apples hungry jack original syrup hungry jack pancake waffle mix milk hungry jack original syrup brown sugar sugar cinnamon butter frosting cream cheese pancake syrup confectioners sugar
256959,potato nuggets tater tots cooking spray mushrooms onion red bell pepper spinach green onions sun dried tomatoes bacon eggs heavy whipping cream salt garlic powder onion powder ground black pepper shredded monterey jack cheese
256960,sausage eggs ground cinnamon salt ground black pepper cooking spray mini wonton wrappers manchego cheese
256961,cooking spray ham eggs salt ground black pepper sweet onion shredded cheddar cheese shredded mozzarella cheese
256962,bacon eggs milk butter dried parsley salt ground black pepper ham shredded mozzarella cheese gouda cheese
256963,onion brown sugar white wine vinegar cooking spray egg whites eggs shredded gouda cheese thick prosciutto cubed
256964,cream cheese shrimp mayonnaise chile sauce onion worcestershire sauce lemon juice
256965,shrimp cream cheese mayonnaise best foods cocktail sauce celery bacon shredded cheddar cheese green onions worcestershire sauce hot sauce seafood seasoning bay green bell pepper
256966,cream cheese cans chili without beans skyline chili shredded cheddar cheese
256967,starter active dry yeast warm flour dough active dry yeast white sugar warm lard fine salt flour cornmeal spray of loaves
256968,mayonnaise mustard cayenne pepper cuban bread swiss cheese smoked fully ham pulled pork heated dill pickle butter
256972,butter wheat bread egg muenster cheese
256973,dried mixed fruit brewed earl grey tea flour almond meal baking powder dark brown sugar egg
256974,flour sifted coarse wheat flour baking soda sprig rosemary stemmed salt buttermilk honey
256976,raisins golden raisins sultanas candied mixed fruit peel molasses treacle optional warm strong black tea self rising flour turbinado demerara sugar egg pumpkin pie spice mixed spice
256977,lamb shoulder salt ground black pepper onion thickly potatoes carrots thickly parsley
256978,smoked streaky bacon good quality sausages onion thickly potatoes parsley
256979,empanada pastry rounds butter spring onions sweet corn salt ground black pepper ground nutmeg flour milk parmesan cheese
256980,spinach salt ground black pepper ricotta cheese parmesan cheese egg nutmeg spinach pasta dough flour
256981,pork shoulder hanger steak onglet pork fat beer salt garlic red pepper flakes optional ground white pepper caraway seeds dried marjoram ground nutmeg ground allspice ground ginger hog casing
256982,flour vegetable oil
256983,bone chicken thighs with skin salt ground black pepper baby red potatoes olive oil ketchup bourbon apple cider juice cornstarch ground black pepper
256984,rice long grain brown rice salt dressing lime olive oil sesame oil dried thai basil hot chile pepper vegetables sesame seeds snow peas chickpeas firm tofu baby corn carrots green bell pepper green onions the diagonal cilantro
256985,flour sifted coarsely ground wheat flour sunflower seeds baking soda salt buttermilk
256986,crawfish tails creole seasoning butter onion green bell pepper garlic ground black pepper cornstarch bread loaves
256987,ground sausgae red onion garlic pepper italian seasoning gemelli pasta butter garlic powder vienna bread marinara sauce tomatoes shredded mozzarella cheese italian seasoning
256988,sour cream mayonnaise dried chipped beef parsley onion seasoned salt spice islands beau monde seasoning dill rye bread
256989,bulk italian sausage eggs milk flour unsalted butter cooled salt black pepper shredded white cheddar cheese chives thyme
256990,potatoes vegetable oil smoked streaky bacon round camembert cheese cooleeney irish camembert white cheddar cheese spring onion cream butter salt black pepper
256991,digestive biscuits unsalted butter cubed irish stout beer guinness white sugar heavy whipping cream containers mascarpone cheese honey lemon sheets gelatin
256992,olive oil pork chops beer soy sauce honey dijon mustard garlic apple colcannon potatoes butter milk curly kale salt ground black pepper
