recipe_id,ingredients
256378,pasteurized eggs separated white sugar milk jigger brandy jigger bourbon jigger molasses rum heavy whipping cream
256379,hot unsalted butter chain triglyceride mct oil cacao powder cacao butter vanilla powder liquid stevia salt
256380,thick cucumber jalapeno pepper sprigs mint
256381,dark rum palm sugar ice banana juice
256382,cooking spray dry corn muffin mix jiffy eggs milk ham shredded cheddar cheese
256383,rolled oats banana ground turmeric ground cinnamon peanut butter
256384,club soda lime juice honey ice
256385,ice cubes vodka pineapple juice raspberry liqueur chambord pineapple lemon peel
256386,eggnog rice vanilla extract ground nutmeg salt egg
256387,tri color rotini pasta lemon juice canola oil mayonnaise seasoned salt lawry s flavor enhancer accent cucumbers tomatoes pimento stuffed green olives black olives green bell pepper green onions
256388,cooking spray sweet potato sifted wheat flour baking soda ground cinnamon ground nutmeg salt ground ginger applesauce eggs maple syrup walnuts optional
256389,flax seeds unsweetened almond milk very banana mashed shredded zucchini vanilla extract gluten free flour unsweetened cocoa powder brown sugar baking blend truvia baking powder baking soda ground cinnamon sea salt cooking spray
256390,olive oil yellow onion garlic sweet peppers yellow squash chunks green bell pepper red bell pepper zucchini chunks chili powder oregano parsley ground paprika ground cumin bay leaves salt ground black pepper tomatoes kidney beans rinsed chili beans tomatoes
256391,cooking spray cans pumpkin puree evaporated milk eggs white sugar ground cinnamon ground nutmeg ground allspice gluten free yellow cake mix butter pecans
256392,cans cherry pie filling white cake mix butter
256393,cooking spray flour baking soda ground cinnamon ground nutmeg salt white sugar vegetable oil eggs vanilla extract apples walnuts
256394,steak sauce reduced sodium soy sauce rice wine vinegar brown sugar sesame oil onion ginger root beef sirloin steak broccoli florets mushrooms garlic optional
256395,flour salt butter eggs cold
256396,eggs cold chicken broth olive oil parsley salt ground black pepper matzo meal
256397,corn oil ham steak onion green bell pepper gandules pigeon peas rinsed tomato sauce goya sofrito adobo seasoning olive brine green olives sazon seasoning white rice
256398,cream cheese cubed milk unsalted butter cake flour cornstarch egg yolks lemon juice egg whites cream of tartar salt superfine sugar
256399,cooking spray flour baking soda butter brown sugar instant vanilla pudding mix white sugar vanilla extract eggs bag chocolate chips walnuts optional
256400,yellow cake mix mini chocolate chips eggs butter
256401,cooking spray banana bread unsalted butter brown sugar egg sour cream white sugar vanilla extract bananas flour baking soda baking powder salt cream cheese filling cream cheese egg white sugar flour
256402,quinoa flour rice flour xanthan gum dried basil optional dried rosemary optional dried oregano optional salt eggs egg yolk olive oil rice flour
256403,cream cheese butter strawberries confectioners sugar
256404,topping slivered almonds white sugar unsalted butter milk cake flour cream of tartar salt unsalted butter almond paste white sugar eggs lemon juice lemon zest vanilla extract flour
256405,chicken breasts sea salt ground black pepper olive oil unsalted butter shallot prosciutto thirds cremini mushrooms stemmed sweet marsala wine chicken stock flat leaf parsley
256406,spaghetti sauce cabbage ground beef rice green bell pepper onion salt ground black pepper
256407,ice chocolate syrup heavy whipping cream vodka coffee liqueur brown sugar vanilla extract ground cinnamon instant espresso powder salt
256408,white sugar marshmallow cream evaporated milk unsalted butter coffee liqueur kahlua salt semisweet chocolate chips milk chocolate chips pecans vanilla extract
256409,ice pina colada mix rum caffeinated pepper type soda dr pepper
256410,cooking spray full fat ice cream just self rising flour superfine sugar
256411,milk banana ice cubes white sugar graham crackers
256412,bag chocolate chips smooth peanut butter crispy rice cereal vanilla ice cream whipped cream strawberries
256413,baby spinach leaves greek yogurt honeydew melon pear milk ice cubes
256414,cooking spray flour white sugar almond milk vegetable oil vegetable oil eggs chia seeds almond extract vanilla extract baking powder salt
256415,milk raw sugar ground nutmeg ground cardamom ground chia seeds
256416,rolled oats chia seeds freshly brewed coffee milk unsweetened cocoa powder maple syrup
256417,chickpeas artichoke hearts greek yogurt basil pickled jalapeno pepper olive oil lemon hemp seeds garlic ground paprika ground cayenne pepper curry powder
256418,coconut banana apple leaf bok choy broccoli sprouts shredded coconut chia seeds piece ginger root spirulina powder optional
256419,cream cheese brown sugar applewood smoked bacon
256420,white chocolate morsels raspberry extract red food coloring
256421,ground beef mayonnaise yellow mustard sweet pickle relish white wine vinegar onion powder garlic powder ground paprika hamburger bun bottoms hamburger bun onion shredded lettuce dill pickle american cheese salt ground black pepper
256422,pie dough flour white sugar salt very cold butter cubes ice cold filling pink lady apples lemon juice brown sugar unsalted butter strawberry preserves
256423,banana vanilla yogurt milk low fat eggnog ice cubes malted milk powder optional
256424,eggs sweetened condensed milk rum optional vanilla extract aromatic bitters salt pint orange sherbet ground nutmeg
256425,sweetened condensed milk milk vanilla extract
256426,wedges lemon leaves thai basil white sugar vodka ice cubes
256427,carrots red bell peppers chow mein noodles shredded chicken breast shredded romaine lettuce with lids creamy peanut butter low sodium soy sauce vegetable oil white sugar rice vinegar ground coriander
256428,butter shallots sunsweet amaz n prunes chicken breasts brie cheese salt freshly ground black pepper plum jam preserves white balsamic vinegar snipped basil
256429,slivered almonds shredded unsweetened coconut shredded unsweetened coconut sunsweet amaz n prunes wheat pastry flour oats sugar salt baking powder baking soda bittersweet chocolate chunks butter
256430,prune cake sunsweet amaz n prunes flour ground cinnamon ground ground nutmeg granulated sugar eggs butter sunsweet amaz n prune juice baking soda sauce butter granulated sugar white corn syrup honey whipping cream baking soda
256431,balsamic vinegar red onion sunsweet amaz n prunes thick sourdough baguette soft goat cheese baby arugula leaves walnuts
256432,salad quinoa red grapes sunsweet d noir prunes celery green onion walnuts dressing olive oil red wine vinegar honey salt garlic freshly ground black pepper
256434,semisweet chocolate white chocolate conversation heart candies necco freeze dried strawberries pink sprinkles
256435,yams salt cold orange fleshed sweet potatoes glaze brown sugar unsalted butter freshly squeezed lemon juice maple syrup ground ginger ground cinnamon cayenne pepper salt pistachios pecans walnuts garnish
256436,puff pastry dough white sugar dusting
256437,egg egg yolks white sugar cornstarch salt milk vanilla bean cold butter cubed
256439,unsweetened almond milk cacao powder stevia powder almond butter ground cinnamon
256440,bananas kale leaves blueberries almond milk ground flax seeds dates
256441,bacon links turkey sausage eggs shredded italian cheese blend jalapeno pepper vegetable oil hash brown potatoes salsa
256442,almond milk banana dark chocolate bar hershey s special dark broken scoop whey protein powder optional
256443,rolled oats honey peanut butter chocolate chips scoops protein powder macadamia nuts
256444,bag semisweet chocolate chips quick cooking oats almonds pecans raw pumpkin seeds unsweetened flaked coconut honey canola oil ground cinnamon vanilla extract
256445,rolled oats quinoa raisins walnuts almond meal flaxseed meal shredded coconut apple ground cinnamon
256446,egg white lemon juice stevia powder lemon zest coarsely ground coffee beans boiling scotch whiskey honey
256448,bag cranberries white sugar turbinado sugar orange zested ground cinnamon ground ginger ground ground allspice ground black pepper
256449,crust walnuts gluten free oats butter superfine brown rice flour white sugar salt seedless raspberry preserves filling cream cheese white sugar eggs maple syrup lemon zested salt
256450,crust pecans brown sugar flour ground cinnamon salt unsalted butter egg filling sweet potatoes cubed cream cheese cream cheese brown sugar sour cream eggs ground cinnamon ground ginger vanilla bean
256451,mints girl scout cookies butter cream cheese white sugar vanilla extract eggs mints girl scout cookies peppermint extract
256452,butternut squash shredded mozzarella cheese pumpkin pie spice salt
256453,eggs egg whites brown sugar ground cinnamon ground banana mashed matzo meal cooking spray
256454,zucchini onions green bell pepper red bell pepper jalapeno pepper eggs ground cumin ground coriander salt feta cheese chickpea flour cilantro rice flour canola oil
256457,cold rice vanilla extract optional
256458,piece ginger cinnamon stick pods green cardamom pods pod black cardamom split open black tea bags milk white sugar
256459,blueberries low fat unsweetened kefir peanut butter stevia the raw ground flax seed vanilla extract ground cinnamon
256460,mango cubes baby kale unsweetened almond milk orange juice stevia the raw chia seeds
256461,brewed coffee chilled banana unsweetened coconut almond creamer coconut oil cocoa powder stevia the raw
256462,banana raspberries unsweetened almond coconut milk blend stevia the raw coconut oil vanilla extract toppings raspberries flaked coconut chia seeds
256463,flour brown sugar cinnamon cold butter tart apples stevia the raw cornstarch
256464,pie crust flour sea salt unsalted butter well chilled cubes ice filling cherries stemmed cherries partially stevia the raw cornstarch lemon juice milk stevia the raw optional
256465,dressing rice vinegar stevia the raw bakers bag reduced sodium soy sauce hoisin sauce salt ground black pepper red pepper flakes canola oil sesame oil salad napa cabbage roasted chicken breast bit mandarin orange sections well green onions green white parts almonds sesame seeds garnish optional
256466,unsalted butter sugar the raw stevia the raw flour baking powder eggs vanilla extract dutch process cocoa powder walnuts
256467,stevia the raw butter heavy cream pumpkin puree vanilla extract sea salt pumpkin pie spice milk hot coffee
256468,flour sugar the raw stevia the raw baking powder sea salt stick cold unsalted butter cubes milk vanilla sugar the raw stevia the raw cranberries powdered sugar sifted milk pecans
256469,milk apple cider unsalted butter cubed stevia the raw salt flour ground cinnamon eggs granny smith apple sugar the raw stevia the raw apple cider vanilla salt vegetable oil cinnamon
256470,cranberries sugar the raw stevia the raw cornstarch orange zested flour rolled oats sugar the raw stevia the raw sea salt ground nutmeg cold unsalted butter cubes pecans
256471,oat bars quick cooking oats instant raisins raw sunflower seeds raw pumpkin seeds sesame seeds homemade stevia marshmallow cr me see recipe below unsalted butter milk natural smooth peanut butter ground cinnamon vanilla extract homemade stevia marshmallow cr me cold unflavored gelatin stevia the raw bakers bag sugar corn syrup vanilla extract
256472,cake brown sugar stevia the raw canola oil eggs pumpkin puree flour pumpkin pie spice baking powder sauce caramel ice cream topping bourbon whiskey apple juice pecans
256473,butter egg vanilla extract stevia extract the raw flour baking soda salt macadamia nuts chocolate chips
256475,oval sandwich rolls eggs milk green chile peppers shredded sharp cheddar cheese shredded pepper jack cheese smoked paprika salt
256476,baguette eggs milk shredded fontina cheese spinach bacon sun dried tomatoes ground black pepper red pepper flakes
256477,dried rice noodles peanuts freeze dried vegetables powdered peanut butter pb powdered chicken bouillon freeze dried cilantro chia seeds optional salt garlic powder ground ginger garlic powder ground black pepper cayenne pepper optional boiling
256478,cold unflavored gelatin stevia powder unsweetened soft drink mix kool aid
256479,flour white sugar salt chilled unsalted butter cubes vanilla extract cold filling unsalted butter white sugar ground cinnamon
256480,corn syrup heavy whipping cream brown sugar
256481,sweet potatoes self rising flour salt butter white sugar raisins ground cinnamon ground nutmeg ground allspice
256482,milk egg ground cinnamon panettone butter
256483,lobster tails lemon wedges parmesan cheese butter creamy salad dressing miracle whip ground paprika
256484,irish stout beer guinness unsalted butter white sugar unsweetened cocoa powder sour cream eggs vanilla extract flour sifted baking soda frosting butter cream cheese vanilla extract confectioners sugar sifted irish cream liqueur
256485,cooking spray olive oil asparagus rosemary sheets phyllo dough mozzarella canadian bacon
256486,white bread bacon asparagus butter garlic salt mozzarella cheese red pepper flakes
256487,salt elbow macaroni cooking spray butter cans evaporated milk milk eggs sour cream white sugar ground black pepper salt colby jack cheese processed cheese food velveeta cubes shredded cheddar cheese
256524,cooking spray devil s food cake mix peanut butter peanuts eggs vegetable oil sweetened condensed milk peanut butter reese s whipped topping
256525,flour ground paprika garlic powder chicken breasts vegetable oil tomato leaves romaine lettuce optional wheat buns
256526,flour egg ranch dressing mix hidden valley chicken breasts vegetable oil mayonnaise sriracha sauce potato rolls dill pickle chips
256527,vinegar vegetable oil eggs salt poultry seasoning ground black pepper chicken thighs
256528,chicken breasts dry ranch dressing mix hidden valley ranch bacon green bell pepper optional alfredo sauce milk garlic penne pasta shredded mozzarella cheese
256529,cooking spray chicken thighs salt ground black pepper egg shredded mozzarella cheese onion roma tomato black olives seasoned bread crumbs toothpicks red potatoes scrubbed carrots olive oil
256530,cake cooking spray devil s food cake mix eggs vegetable oil frosting cold milk instant chocolate pudding mix confectioners sugar whipped topping strawberry glaze strawberries chocolate syrup
256531,cooking spray devil s food cake mix sour cream eggs coffee liqueur kahlua vegetable oil instant chocolate pudding mix orange zest ground cinnamon mini chocolate chips confectioners sugar
256532,bow tie pasta chicken breasts creole seasoning tony chachere s vegetable oil onion red bell pepper green bell pepper alfredo sauce parmesan cheese
256533,cupcakes white sugar butter eggs vanilla extract baking powder self rising flour frosting confectioners sugar butter
256534,butter white sugar white sugar eggs vanilla extract self rising flour buttercream filling confectioners sugar confectioners sugar butter vanilla extract raspberry jam
256535,celery salt ground black pepper salt garlic salt onion salt worcestershire sauce beef brisket russian dressing hickory barbeque sauce
256536,garlic powder chili powder paprika dried basil chicken tenderloins vegetable oil onion green bell pepper red bell pepper
256537,chicken thighs coconut aminos soy free seasoning sauce dry sherry rice wine vinegar sesame oil ginger garlic shredded bok choy sesame seeds optional
256538,vegetable oil semisweet chocolate morsels unsalted butter white sugar eggs vanilla extract
256539,flour walnuts white sugar baking powder ground nutmeg ground cinnamon baking soda salt almond milk overripe bananas mashed butter vanilla extract egg
256540,tomatoes green bell peppers red bell pepper cucumber olive oil red onion scallions lemon juice parsley mint dill vinegar garlic ground sumac salt ground black pepper
256541,eggplant garlic unpeeled lemon juice tahini salt olive oil ground sumac
256542,boiling oats butter brown sugar white sugar mashed overripe bananas eggs vanilla extract flour baking soda ground cinnamon salt topping caramel sweetened condensed milk brown sugar walnuts optional sweetened flaked coconut optional butter heavy whipping cream
256543,russet potatoes scrubbed butter salt ground black pepper real bacon bits sour cream shredded cheddar cheese chives
256544,olive oil sweet potato sausage onion red bell pepper mushrooms torn kale leaves salt ground black pepper eggs dried thyme green onion
256545,carton low sodium vegetable broth imagine low sodium chicken broth caraway seeds dried cilantro dried tarragon coriander seeds colored carrots parsnips rutabaga cubed white onion wedges ground white pepper green onion
256546,slab pork baby back ribs rib portions ground black pepper chinese five spice powder sauce hoisin sauce pineapple juice green onions rice wine vinegar sesame oil brown sugar bottled ginger bottled garlic
256547,bacon crosswise balls pizza dough yellow onion fromage blanc french cheese creme fraiche ground nutmeg salt freshly ground black pepper cayenne pepper
256548,garlic freshly ground black pepper egg white center beef tenderloin roast coarse ground sea salt
256549,russet potato scrubbed butter american cheese shredded cheddar cheese eggs salt ground black pepper green onion sriracha sauce
256550,quick cooking oats flour brown sugar baking soda salt butter dates dried apricots orange juice vanilla extract
256551,skin chicken thighs salt ground black pepper butter red onion garlic baby red potatoes red bell pepper sriracha sauce brown sugar
256552,mayonnaise sweet pickle relish ketchup white onion olive oil white sugar white vinegar lemon juice dry mustard ground paprika salt ground black pepper hamburger patties salad greens shredded cheddar cheese onion dill pickle chips
256553,low sodium bacon olive oil optional onion optional pizza dough trader joe s part ricotta cheese garlic powder shredded part mozzarella cheese freshly ground black pepper cooking spray baby spinach
256554,ricotta cheese gnocchi broccoli florets butter onion garlic chicken sausage links aidells butter flour salt ground black pepper
256555,zucchini chicken breasts cubed poultry seasoning butter onion oil sun dried tomatoes sun dried tomato oil garlic evaporated milk parmesan cheese vegan cream cheese substitute tofutti optional salt red pepper flakes dried basil
256556,cooking spray bacon onion spinach milk eggs croissants cubed shredded monterey jack cheese
256557,cooking spray strawberries gluten free oats greek yogurt unsweetened applesauce egg whites dairy free dark chocolate chips unsweetened vanilla almond milk baking powder ground cinnamon almond extract sea salt
256558,pineapple carrot almond milk oats ground cinnamon optional ground ginger walnuts
256559,cooking spray gluten free rolled oats almond milk egg separated butter brown sugar baking powder
256560,avocados cubed tomatoes cans black beans rinsed corn rinsed cilantro red onion vegetable oil red wine vinegar salt ground black pepper flour tortillas shredded monterey jack cheese sour cream
256561,banana cucumbers red bell pepper ruby red grapefruit juice carrots ice cubes
256562,brown rice flour cold butter cubes cold eggs apple cider vinegar gluten free flour blend ice cold
256563,fillets hake gluten free pasta olive oil red onion tomato paste garlic red wine tomatoes dried oregano dried basil dried dill weed lemon juice salt ground black pepper
256564,bananas egg gluten free baking flour honey vegetable oil flaxseed meal bourbon vanilla extract baking powder baking soda xanthan gum ground nutmeg salt pecans
256565,banana golden flax seeds chia seeds scoops vanilla protein powder powdered peanut butter dairy free mini chocolate chips
256566,thai glutinous rice coconut milk dates himalayan salt cornstarch mangoes sesame seeds
256567,cooking spray crust gluten free flour blend namaste perfect flour blend pecans butter brown sugar filling cream cheese sugar salt eggs vanilla extract lemon extract
256568,littleneck clams shucked milk gluten free baking flour masa harina salt ground black pepper ground cayenne pepper oil
256569,reduction tarragon leaves coarsely shallots black peppercorns white wine vinegar white wine compound butter tarragon capers cold unsalted butter bearnaise egg yolks tarragon vinegar reduction cold unsalted butter caper tarragon compound butter salt cayenne pepper freshly ground black pepper optional
256576,wheat english muffin split peanut butter banana honey chia seeds
256577,chia pudding coconut milk unsweetened rice milk chia seeds maple syrup raspberry chia jam raspberries chia seeds vanilla extract
256578,tuna brown sugar sea salt ahi tuna sopes masa corn flour salt tomatillo sauce tomatillos husked onion jalapeno peppers salt pico de gallo tomatoes avocados cilantro limes cabbage shredded queso fresco
256579,vanilla greek yogurt creamy peanut butter milk ground cinnamon ground nutmeg ground red chile pepper salt
256580,greek yogurt bananas white sugar walnuts mini chocolate chips
256581,pineapple vanilla yogurt fit cream of coconut containers coconut vanilla greek yogurt fit heavy whipping cream white sugar rum extract optional
256582,walnuts semisweet chocolate chips unsalted butter unsalted butter maple extract marshmallows peppermint extract
256583,sugar cara cara orange maple syrup
256584,basmati rice split mung beans ginger ground coriander dried oregano leaves garlic ground cumin fennel seeds
256585,crust gluten free flour almond meal baking soda salt gluten free rolled oats brown sugar white sugar unsalted butter vanilla extract almond extract optional apricot ginger filling white sugar cornstarch apricots ginger
256586,white sugar yeast low fat milk warmed yam egg vanilla extract wheat flour flour brown sugar ground cinnamon salt cooking spray brown sugar ginger sauce milk brown sugar ginger cornstarch
256587,fl oz ginger ale canada dry black tea bag lipton
256588,young ginger root white sugar
256589,olive oil sweet onion chinese eggplant zucchini baby bella mushrooms salt ground black pepper sun dried tomatoes oil garlic dried basil vegetable stock tri colored pearl couscous sun dried tomato oil shaved parmesan cheese
256590,cauliflower stemmed cucumbers baby carrots radishes mushrooms stemmed cilantro leaves kale stemmed poblano pepper lime juice white vinegar ground paprika olive oil garlic oregano ground cumin chili powder ground ground coriander salt ground black pepper
256591,olive oil white onion garlic collard greens leaves torn red pepper flakes vegetable broth apple cider vinegar brown sugar liquid smoke flavoring smoked paprika
256592,cauliflower broken florets chickpeas red potatoes cubes zucchini yellow squash sweet onion olive oil curry powder salt ground black pepper vegetable broth optional
256593,ground red chile pepper white sugar cornstarch ground black pepper salt paneer corn oil garlic onion green bell pepper thick lettuce hot pepper sauce encona soy sauce vinegar coarsely cilantro
256594,long grain white rice vegetable oil onion cumin seeds bay leaves broken potatoes carrots ground turmeric chile powder ground coriander peas salt butter garam masala
256595,coconut oil oat flour chickpea flour ground cinnamon baking soda ground nutmeg salt apple butter honey eggs carrots apples shredded coconut raisins walnuts
256596,thick buttermilk chickpea flour white sugar asafoetida powder ground turmeric salt peanut oil mustard seeds curry leaves asafoetida powder
256597,tahini lemon juice ground cumin ground fennel seed salt ground black pepper hot sauce cholula olive oil garlic powder chickpea flour
256598,white sugar sweetened condensed milk bread crusts oil
256599,grape tomatoes cucumber green onions cilantro lemon juice mint salt ground black pepper
256600,cucumbers yogurt mountain high garlic dried mint salt
256601,cooking spray quinoa gluten free oat flour unsweetened vanilla almond milk maple syrup raisins egg white vanilla extract ground cinnamon sea salt
256602,tamarind pulp dates dried apricots white sugar ground black pepper salt
256603,sweet corn rinsed well green chile peppers onion rice flour besan chickpea flour sprig curry leaves ginger garlic paste garam masala ground red chile pepper ground cumin ground turmeric salt vegetable oil
256604,scoops chocolate ice cream nestle real dairy milk banana ice cubes white sugar vanilla extract
256605,canola oil onion jalapeno pepper garlic cans white beans carrots quinoa vegetable broth tomatoes green chiles ro tel soy sauce red bell pepper peanut butter cilantro hot pepper sauce tabasco lime wedges freshly ground black pepper
256606,flour wheat flour flax seeds hemp seeds baking powder ground cinnamon salt low fat milk warmed eggs vegetable oil vanilla extract chocolate filling low fat milk dark brown sugar unsweetened cocoa powder unsalted butter cooking spray
256607,baking mix bisquick rolled oats milk hemp seeds optional blueberries butter brown sugar
256608,brown sugar butter egg hemp seeds hemp hearts flour ground cinnamon
256609,dried garbanzo beans olive oil onion stalks celery carrots garlic fennel seeds vegetable broth fire roasted tomatoes grape tomatoes baby spinach leaves parsley oregano thyme salt ground black pepper
256610,cabbage vegetable oil onion garlic uncooked white rice rinsed ground beef ground pork sausage egg tomato juice
256611,tomato sauce san marzano tomatoes low sodium chicken broth garlic dried parsley tomato paste sea salt ground black pepper ground beef ground pork yellow onion garlic dried basil dried oregano dried parsley sea salt ground black pepper sea salt cauliflower heads green cabbage zucchini eggs almond flour
256612,heads cabbage shredded salt vinegar white sugar vegetable oil ground turmeric celery seed mustard seeds onions sweet red peppers
